Chapter,Section,Variable Name,Variable Id,Definition,Format,Other Metadata
GovTech Maturity,Cloud,Shared cloud platform,govtech-cloud-1,Is there a shared cloud platform available for all government entities?,0=Unknown/n.a;1=No;2=Only cloud strategy/policy (no platform yet);3=Yes (platform in use),
GovTech Maturity,Cloud,Cloud platform type,govtech-cloud-1.4,Type of cloud platform established,0=Unkown/n.a.;1=Public (Commercial);2=Private (Government);3=Hybrid,"Type of cloud > Public: Commercial operators; outside/in country; Private: Operated by government entities; on-premise, 3= Hybrid (combination of public & private)"
GovTech Maturity,Cloud,Hosting policy,govtech-cloud-1.6,Government Cloud data hosting policy?,0=Unknown/n.a;1=No policy / Unkown/n.a.;2=Keeping data inside the country;3=Keeping data outside the country;4=Hybrid (inside + outside),
GovTech Maturity,Cloud,Service provided,govtech-cloud-1.7,Cloud services provided,0=Unkown/n.a.;1=SaaS;2=PaaS;3=IaaS;4=XaaS,Cloud services > SaaS: Software as a Service; PaaS: Platform as a Service; IaaS: Infrastructure as a Service; XaaS: Anything as a Service
GovTech Maturity,Cloud,Single shared platform,govtech-cloud-1.8,Is there one shared Government Cloud platform or several?,0=Unkown/n.a.;1=Several cloud platforms (Central/Local levels);2=One shared cloud platform,
GovTech Maturity,Cloud,Transparency,govtech-cloud-1.9,"Monitoring & publishing of cloud usage, security, savings, etc.?",0=Unknown/n.a;1=No;2=Yes (internal;not published); 3=Yes (public;published),
GovTech Maturity,Interoperability,Interoperability framework exists,govtech-interop-3,Is there a government interoperability framework?,0=Unknown/n.a;1=No;2=In draft / Planned;3=Yes ,European Interoperability Framework (EIF) or similar country specific frameworks
GovTech Maturity,Interoperability,Interoperability status,govtech-interop-3.4,GIF operational status,0=Unkown/n.a.;1=Partially used;2=Extensively used,
GovTech Maturity,Interoperability,Data quality,govtech-interop-3.6,Is there a data quality framework?,0=Unknown/n.a;1=No;2=Yes,"Data quality framework for ensuring that Government data is standardised, not fragmented, and not duplicated."
GovTech Maturity,Interoperability,Uptime monitoring,govtech-interop-3.7,Is there a system to monitor the 'uptime' of government information systems?,0=Unknown/n.a;1=No;2=Yes,
GovTech Maturity,Interoperability,Replacing legacy systems,govtech-interop-3.8,Is there guidance for replacing legacy government information systems?,0=Unknown/n.a;1=No;2=Yes,
GovTech Maturity,Interoperability,Transparency,govtech-interop-3.9,"Monitoring & publishing of GIF usage, compliance, benefits?",0=Unknown/n.a;1=No;2=Yes (internal;not published); 3=Yes (public;published),
GovTech Maturity,Financial Management,IFMIS exists,govtech-financial-5,Is there an operational FMIS in place to support core PFM functions?,0=Unkown/n.a.;1=Implementation in progress;2=Yes (in use),
GovTech Maturity,Financial Management,IFMIS functionality,govtech-financial-5.6,FMIS functional capabilities,0=Unkown/n.a.;1=Treasury (execution);2=T + Budget (preparation);3=T + B + Other,
GovTech Maturity,Financial Management,Scope,govtech-financial-5.7,Scope of FMIS (coverage of budgets),0=Unkown/n.a.;1=Central gov;2=Central + Local gov,
GovTech Maturity,Financial Management,Software,govtech-financial-5.8,Type of FMIS software,0=Unkown/n.a.;1=Custom Software;2=Commercial/COTS Software;3=Hybrid (Custom + COTS),
GovTech Maturity,Financial Management,Chart of Accounts,govtech-financial-5.10,Is there a unified budget classification/chart of accounts?,0=Unknown/n.a;1=No;2=Yes (Central government only);3=Yes (Both central and sub-national government),"Unified budget classification (BC) / chart of accounts (CoA) to record/report all budget revenues, expenses and other transactions?"
GovTech Maturity,Financial Management,SDG monitoring,govtech-financial-5.11,Does FMIS capture expenses linked to the SDGs and other strategic goals?,0=Unknown/n.a;1=No;2=Partially;3=Extensively,"Budget expenses linked to the Sustainable Development Goals (SDGs) using gender, climate change and other tags."
GovTech Maturity,Financial Management,Programme monitoring,govtech-financial-5.12,Does FMIS capture non-financial data (KPIs) on programs/projects?,0=Unknown/n.a;1=No;2=Partially (Some of the KPIs for selected programs);3=Extensively (KPIs captured for most of the programs),Non-financial data or Key Performance Indicators (KPIs) related to the programs/projects/activities.
GovTech Maturity,Financial Management,Interoperability,govtech-financial-5.13,Does FMIS exchange data with other systems?,0=Unknown/n.a;1=No;2=Yes (via separate interfaces) 3=Yes (via Government Service Bus),"To select I-5.13= 2, I-4 should be 2 (GSB in use)"
GovTech Maturity,Financial Management,Governance,govtech-financial-5.14,"Governance of FMIS operations (compliance, security, audit trails, etc.)?",0=Unknown/n.a;1=No;2=Yes (internal;not published); 3=Yes (public;published),
GovTech Maturity,Treasury Single Account,Automated payments,govtech-treasury-6,Is there a TSA supported by FMIS to automate payments and bank reconciliation?,0=Unknown/n.a;1=No;2=Implementation in progress;3=Yes (in use),
GovTech Maturity,Treasury Single Account,Scope,govtech-treasury-6.5,Scope of TSA operations,0=Unkown/n.a.;1=Partially used by the MDAs;2=Extensively used by all MDAs,"MDAs: Ministries, Departments, Agencies"
GovTech Maturity,Treasury Single Account,Payment system,govtech-treasury-6.6,Type of electronic payment systems in place,0=Unkown/n.a.;1=RTGS (Real-Time Gross Settlement);2=FPS / ACH (Fast Payment System / Automated Clearinghouse System);3=Both RTGS & FPS/ACH,"RTGS: Real Time Gross Settlements, ACH: Automated Clearing House"
GovTech Maturity,Treasury Single Account,Central Bank interface,govtech-treasury-6.7,Is there a TSA interface linking FMIS with the Central Bank systems?,0=Unknown/n.a;1=No;2=Implementation in progress;3=Yes (in use),"To select I-6.7= 2, I-4 should be 2 (GSB in use)"
GovTech Maturity,Treasury Single Account,Governance,govtech-treasury-6.8,"Governance of TSA operations (compliance, security, audit trails, etc.)?",0=Unknown/n.a;1=No;2=Yes (internal;not published); 3=Yes (public;published),
GovTech Maturity,Tax Management,System exists,govtech-taxmanage-7,Is there a Tax Management Information System in place?,0=Unknown/n.a;1=No;2=Implementation in progress;3=Yes (in use),
GovTech Maturity,Tax Management,Software,govtech-taxmanage-7.6,Type of TMIS software,0=Unkown/n.a.;1=Custom Software;2=Commercial/COTS Software;3=Hybrid (Custom + COTS),
GovTech Maturity,Tax Management,Interoperability,govtech-taxmanage-7.7,Does TMIS exchange data with other systems?,0=Unknown/n.a;1=No;2=Yes (via separate interfaces) 3=Yes (via Government Service Bus),"To select I-7.7= 2, I-4 should be 2 (GSB in use)"
GovTech Maturity,Tax Management,Governance,govtech-taxmanage-7.8,"Governance of TMIS operations (compliance, security, audit trails, etc.)?",0=Unknown/n.a;1=No;2=Yes (internal;not published); 3=Yes (public;published),
GovTech Maturity,Customs Management,System exists,govtech-customs-8,Is there a Customs Management Information System in place?,0=Unknown/n.a;1=No;2=Implementation in progress;3=Yes (in use),
GovTech Maturity,Customs Management,Software,govtech-customs-8.6,Type of CMIS software,0=Unkown/n.a.;1=Custom Software;2=Commercial/COTS Software;3=Hybrid (Custom + COTS),
GovTech Maturity,Customs Management,Customs-Tax interoperability,govtech-customs-8.7,Customs and Tax administrations merged?,0=Unknown/n.a;1=No;2=Yes,
GovTech Maturity,Customs Management,Interoperability,govtech-customs-8.8,Does CMIS exchange data with other systems?,0=Unknown/n.a;1=No;2=Yes (via separate interfaces) 3=Yes (via Government Service Bus),"To select I-8.8= 2, I-4 should be 2 (GSB in use)"
GovTech Maturity,Customs Management,Governance,govtech-customs-8.9,"Governance of CMIS operations (compliance, security, audit trails, etc.)?",0=Unknown/n.a;1=No;2=Yes (internal;not published); 3=Yes (public;published),
GovTech Maturity,HR Management,System exists,govtech-hr-9,Is there a Human Resources Management Information System with self-service portal?,0=Unknown/n.a;1=No;2=Implementation in progress;3=Yes (in use),
GovTech Maturity,HR Management,Software,govtech-hr-9.4,Type of HRMIS software,0=Unkown/n.a.;1=Custom Software;2=Commercial/COTS Software;3=Hybrid (Custom + COTS),
GovTech Maturity,HR Management,Portal,govtech-hr-9.6,Is there a HRMIS self-service portal for employees and managers?,0=Unknown/n.a;1=No;2=Yes (but there are still manual processes/paperwork);3=Yes (most of the services are online/digitized),
GovTech Maturity,HR Management,Interoperability,govtech-hr-9.7,Does HRMIS exchange data with other systems?,0=Unknown/n.a;1=No;2=Yes (via separate interfaces) 3=Yes (via Government Service Bus),"To select I-9.7= 2, I-4 should be 2 (GSB in use)"
GovTech Maturity,HR Management,Uses national Id,govtech-hr-9.8,Does HRMIS use national ID as primary or secondary identifier?,0=Unknown/n.a;1=No;2=Yes,
GovTech Maturity,HR Management,Governance,govtech-hr-9.9,"Governance of HRMIS operations (registers, security, audit trails, etc.)?",0=Unknown/n.a;1=No;2=Yes (internal;not published); 3=Yes (public;published),
GovTech Maturity,Payroll,System exists,govtech-payroll-10,Is there a Payroll System (MIS) linked with HRMIS?,0=Unknown/n.a;1=No;2=Implementation in progress;3=Yes (in use),
GovTech Maturity,Payroll,Software,govtech-payroll-10.4,Type of Payroll System software,0=Unkown/n.a.;1=Custom Software;2=Commercial/COTS Software;3=Hybrid (Custom + COTS),
GovTech Maturity,Payroll,Governance,govtech-payroll-10.6,"Governance of Payroll System operations (registers, security, audit trails, etc.)?",0=Unknown/n.a;1=No;2=Yes (internal;not published); 3=Yes (public;published),
GovTech Maturity,Social Insurance,System exists,govtech-socialinsure-11,Is there a Social Insurance system (non-health) providing pensions (including public sector) and other SI programs?,0=Unknown/n.a;1=No;2=Implementation in progress;3=Yes (in use),"Any public sector agency that operates a social insurance program(s) (non-health insurance) - pensions (including public sector), other social insurance and/or social assistance - where such program(s), individually or collectively, cover at least 5 percent of the population (measured by either number of beneficiaries and/or number of the insured members). If country does not have an agency that covers 5 percent of the population, then such an agency with the highest coverage of such program(s)."
GovTech Maturity,Social Insurance,Status,govtech-socialinsure-11.7,Status of public sector SI / Pension MIS platform,0=Unkown/n.a.;1=Separate SI / Pension MIS for public employees;2=Primary pension MIS is used for public employees as well,
GovTech Maturity,Social Insurance,Platform type,govtech-socialinsure-11.8,Type of primary SI / Pension MIS platform,0=Unkown/n.a.;1=Custom Software;2=Commercial/COTS Software;3=Hybrid (Custom + COTS),
GovTech Maturity,Social Insurance,Interoperability,govtech-socialinsure-11.9,Is primary SI / Pension MIS exchanging data with other systems?,0=Unknown/n.a;1=No;2=Yes (via separate interfaces) 3=Yes (via Government Service Bus),"To select I-11.9= 2, I-4 should be 2 (GSB in use)"
GovTech Maturity,Social Insurance,Uses national id,govtech-socialinsure-11.1,Does the primary SI / Pension MIS use national ID as primary or secondary identifier?,0=Unknown/n.a;1=No;2=Yes,
GovTech Maturity,Social Insurance,Uses national id,govtech-socialinsure-11.1,Are all SI / Pension beneficiary records fully digitized?,0=Unknown/n.a;1=No;2=Partially digitized;3=Fully digitized,
GovTech Maturity,Social Insurance,Uses national id,govtech-socialinsure-11.1,Are all active insured public employee records fully digitized?,0=Unknown/n.a;1=No;2=Partially digitized;3=Fully digitized,
GovTech Maturity,Social Insurance,Uses national id,govtech-socialinsure-11.1,Can a contribution report and payment be submitted online?,0=Unknown/n.a;1=No;2=Yes,
GovTech Maturity,Social Insurance,Uses national id,govtech-socialinsure-11.1,"Governance of SI / Pension MIS operations (registers, security, audit trails, etc.)?",0=Unknown/n.a;1=No;2=Yes (internal;not published); 3=Yes (public;published),
GovTech Maturity,e-Procurement,System exists,govtech-procure-12,Is there an e-Procurement portal?,0=Unknown/n.a;1=No;2=Implementation in progress;3=Yes (in use),
GovTech Maturity,e-Procurement,Capabilities,govtech-procure-12.4,e-Procurement Portal capabilities,0=Unkown/n.a.;1=Tender notices + Contracts;2=Online Tendering + Contracts;3=OT + C + Interfaces with other systems,
GovTech Maturity,e-Procurement,Standards,govtech-procure-12.5,e-Procurement data published in line with OCDS?,0=Unknown/n.a;1=No;2=Yes,
GovTech Maturity,e-Procurement,Interoperability,govtech-procure-12.6,Does eProcurement Portal exchange data with other systems?,0=Unknown/n.a;1=No;2=Yes (via separate interfaces) 3=Yes (via Government Service Bus),
GovTech Maturity,e-Procurement,Governance,govtech-procure-12.8,"Governance of eProcurement operations (registers, security, audit trails, etc.)?",0=Unknown/n.a;1=No;2=Yes (internal;not published); 3=Yes (public;published),
GovTech Maturity,Debt Management,Debt system exists,govtech-debt-13,Is there a Debt Management System (DMS) in place? (foreign and domestic debt),0=Unknown/n.a;1=No;2=Implementation in progress;3=Yes (in use),
GovTech Maturity,Debt Management,Software,govtech-debt-13.4,Type of DMS software,0=Unkown/n.a.;1=Custom Software;2=Commercial/COTS Software;3=Hybrid (Custom + COTS),
GovTech Maturity,Debt Management,Investment system exists,govtech-debt-14,Is there a Public Investment Management System (PIMS) in place?,0=Unknown/n.a;1=No;2=Implementation in progress;3=Yes (in use),
GovTech Maturity,Debt Management,Software,govtech-debt-14.4,Type of PIMS software,0=Unkown/n.a.;1=Custom Software;2=Commercial/COTS Software;3=Hybrid (Custom + COTS),
GovTech Maturity,Debt Management,Interoperabiaity,govtech-debt-14.6,Does PIMS exchange data with other systems?,0=Unknown/n.a;1=No;2=Yes (via separate interfaces) 3=Yes (via Government Service Bus),
GovTech Maturity,Debt Management,Transparency,govtech-debt-14.7,"Publishing of PIMS project database, results?",0=Unknown/n.a;1=No;2=Yes (internal;not published); 3=Yes (public;published),
GovTech Maturity,Open Source,Policy  ,govtech-opensource-15,Is there a government Open Source Software policy/action plan for public sector?,0=Unknown/n.a;1=No;2=Yes (Advisory/R&D);3=Yes (Mandatory),
GovTech Maturity,Open Source,Governance,govtech-opensource-15.3,Is there an entity taking decisions on adopting/procuring an OSS solution?,0=Unkown/n.a.;1=Ministry level Chief Information Officer 2=Government CIO;3=Other,
GovTech Maturity,Open Source,Level of adoption,govtech-opensource-15.4,What is the level of adoption of OSS policy?,0=Unkown/n.a.;1=Partially adopted in several sectors;2=Extensively adopted,
GovTech Maturity,Open Source,Innovation  ,govtech-opensource-17,Does government have a national strategy on disruptive / innovative technologies?,0=Unknown/n.a;1=No;2=In draft / Planned;3=Yes,"Disruptive / innovative technology strategy with measurable targets (e.g., Artificial Intelligence, Blockchain)"
GovTech Maturity,Public Service Portal,Portal exists,govtech-serviceportal-19,"Is there an online public service portal? (also called ""One-Stop Shop"" or similar)",0=Unknown/n.a;1=No;2=Yes (Informational: Level 1 or 2);3=Yes (Transactional: Level 3 or 4),"Integrated online public service portals, also called ""One-Stop Shop"" or similar, provide access to all available services. UN Level 1 or 2 is mostly information"
GovTech Maturity,Public Service Portal,Citizen involvement,govtech-serviceportal-19.2,Are citizens / businesses involved in the design of e-Services (user-centric design)?,0=Unknown/n.a;1=No;2=Yes,
GovTech Maturity,Public Service Portal,Access  ,govtech-serviceportal-19.3,Universal accessibility (omnichannel access)?,0=Unknown/n.a;1=No;2=Yes,Universal accessibility or omnichannel access enables individuals with disabilities and vulnerable groups to gain access to all services and participate fully in all aspects of life in an inclusive society through varied media including mobile phones. The emphasis on universal accessibility is intended to ensure that government-provided services reach all intended beneficiaries and users
GovTech Maturity,Public Service Portal,Mobile access,govtech-serviceportal-19.4,Has the government released any mobile app for the citizens' access to public services?,0=Unknown/n.a;1=No;2=Yes,
GovTech Maturity,Public Service Portal,Online business registration,govtech-serviceportal-19.5,Can residents start a business through online service portal?,0=Unknown/n.a;1=No;2=Yes,
GovTech Maturity,Public Service Portal,Residency application,govtech-serviceportal-19.6,Can individuals establish an e-residency through online service portal?,0=Unknown/n.a;1=No;2=Yes,
GovTech Maturity,Public Service Portal,Transparency,govtech-serviceportal-19.7,Publishing of online service delivery performance/user experience?,0=Unknown/n.a;1=No;2=Yes (internal;not published); 3=Yes (public;published),
GovTech Maturity,Tax Service Portal,Portal exists,govtech-taxportal-20,Is there a Tax online service portal?,0=Unknown/n.a;1=No;2=Implementation in progress;3=Yes (in use),"To select I-20 > 0, I-7 should be 2 (TMIS in use)"
GovTech Maturity,Tax Service Portal,Services,govtech-taxportal-20.2,Available Tax online transactional services,0=Unkown/n.a.;1=Registration + Filing 2=R + F + Payment;3=R + F + P + Other,
GovTech Maturity,Tax Service Portal,Invoicing,govtech-taxportal-20.3,Electronic Invoicing ,0=Unknown/n.a;1=No;2=Planned / In progress 3=Partially implemented 4=Fully implemented / mandatory,
GovTech Maturity,Tax Service Portal,Citizen engagement,govtech-taxportal-20.4,Are citizens/businesses involved in the design of tax online services?,0=Unknown/n.a;1=No;2=Yes,
GovTech Maturity,Tax Service Portal,Access,govtech-taxportal-20.5,Universal accessibility (omnichannel access)?,0=Unknown/n.a;1=No;2=Yes,
GovTech Maturity,Social Insurance Portal,Portal exists,govtech-socialportal-24,Is there a Social Insurance/Pension online service portal?,0=Unknown/n.a;1=No;2=Implementation in progress;3=Yes (in use),"To select I-24 > 0, I-11 should be 2 (SI System in use)"
GovTech Maturity,Social Insurance Portal,Services,govtech-socialportal-24.2,Available SI / Pension online transactional services,0=Unkown/n.a.;1=Registration + Benefits;2=R + B + Payments;3=R + B + P + Other,Involvement of citizens/businesses: Providing feedback on user experience and expectations for the design of SI/Pension services
GovTech Maturity,Social Insurance Portal,Citizen engagement,govtech-socialportal-24.3,Are citizens involved in the design of SI / Pension services/portal? ,0=Unknown/n.a;1=No;2=Yes,
GovTech Maturity,Social Insurance Portal,Access,govtech-socialportal-24.5,Universal accessibility (omnichannel access)?,0=Unknown/n.a;1=No;2=Yes,
GovTech Maturity,Job Portal,Portal exists,govtech-job-25,Is there a Job portal?,0=Unknown/n.a;1=No;2=Implementation in progress;3=Yes (in use),
GovTech Maturity,Job Portal,Services,govtech-job-25.2,Available online transactional Job portal services,0=Unkown/n.a.;1=Registration + Search;2=R + S + Applications;3=R + S + A + Other,
GovTech Maturity,Job Portal,Public sector opportunities,govtech-job-25.3,Inclusion of public sector positions in the Job portal?,0=Unkown/n.a.;1=Separate Job Portal for public employees;2=Primary job portal is used for public employees as well,
GovTech Maturity,Job Portal,Citizen engagement,govtech-job-25.4,Are citizens/employees involved in the design of services/portal?,0=Unknown/n.a;1=No;2=Yes,
GovTech Maturity,Job Portal,Access,govtech-job-25.5,Universal accessibility (omnichannel access)?,0=Unknown/n.a;1=No;2=Yes,
GovTech Maturity,Open Data Portal,Portal exists,govtech-opendata-29,Is there an Open Data portal?,0=Unknown/n.a;1=No;2=Yes,
GovTech Maturity,Open Data Portal,Update frequency,govtech-opendata-29.2,Update frequency of Open Data portal,0=Unkown/n.a.;1=Annually 2=Quarterly / Monthly;3=Weekly / Daily,
GovTech Maturity,Open Data Portal,Contents,govtech-opendata-29.3,Contents / maturity of Open Data portal,0=Unkown/n.a.;1=Basic info / datasets;2=Comprehensive data catalog,
GovTech Maturity,Open Data Portal,API updating,govtech-opendata-29.4,Is the portal dynamically updated (via APIs)?,0=Unkown/n.a.;1=Yes (mostly manual);2=Yes (automated updates via APIs),
GovTech Maturity,Citizen Participation,Platforms exist,govtech-particip-30,Are there national platforms that allow citizens to participate in policy decision-making?,0=Unknown/n.a;1=No;2=Yes,
GovTech Maturity,Citizen Participation,Petitions,govtech-particip-30.2,Is it possible to submit petitions?,0=Unknown/n.a;1=No;2=Yes (the same citizen participation portal for petitions as well);3=Yes (separate portal for petitions),
GovTech Maturity,Citizen Participation,Citizen engagement,govtech-particip-30.3,Can citizens / businesses participate in policy decision-making through this platform?,0=Unknown/n.a;1=No;2=Yes,
GovTech Maturity,Citizen Participation,Anonymous feedback,govtech-particip-30.4,Can citizens / businesses provide anonymous feedback?,0=Unknown/n.a;1=No;2=Yes,
GovTech Maturity,Citizen Participation,Access,govtech-particip-30.5,Universal accessibility (omnichannel access)?,0=Unknown/n.a;1=No;2=Yes,
GovTech Maturity,Citizen Participation,Transparency,govtech-particip-30.6,Are government's responses to citizens / businesses publicly available?,0=Unknown/n.a;1=No;2=Yes (internal;not published); 3=Yes (public;published),
GovTech Maturity,Citizen Feedback,Feedback portals,govtech-feedback-31,"Are there government platforms that allow citizens to provide feedback (e.g., complements, complaints, suggestions, info requests) on service delivery?",0=Unknown/n.a;1=No;2=Yes,
GovTech Maturity,Citizen Feedback,Transparency,govtech-feedback-31.2,"Does the government make the service standards (e.g., response times and procedures) available to the public?",0=Unknown/n.a;1=No;2=Yes,
GovTech Maturity,Citizen Feedback,Inclusivity,govtech-feedback-31.3,"Are these platforms universally accessible or provide support for users with disabilities (e.g., e-services, availability of voice commands)?",0=Unknown/n.a;1=No;2=Yes,
GovTech Maturity,Citizen Feedback,AI functionality,govtech-feedback-31.4,"Is there any advanced technology (e.g., chatbots or AI-enabled discussion forums) used to improve citizen engagement?",0=Unknown/n.a;1=No;2=Yes,
GovTech Maturity,Citizen Feedback,Access,govtech-feedback-31.5,Universal accessibility (omnichannel access)?,0=Unknown/n.a;1=No;2=Yes,
GovTech Maturity,Citizen Feedback,Government response,govtech-feedback-31.6,Does the Gov respond to citizen feedback? (how the Gov has updated their services in response to citizen feedback),0=Unknown/n.a;1=No;2=Yes (internal;not published); 3=Yes (public;published),
GovTech Maturity,GovTech Governance,Tech Governance body exists,govtech-govtech-33,"Is there a government entity focused on GovTech (digital transformation, WoG, online services, etc.)?",0=Unknown/n.a;1=No;2=Planned / In progress;3=Yes (Established),WoG: Whole of Government
GovTech Maturity,GovTech Governance,Coordinating body exists,govtech-govtech-33.8,"Is there a Coordination Body (SC, Council) leading GovTech initiatives?",0=Unknown/n.a;1=No;2=Yes,
GovTech Maturity,GovTech Governance,Audit body exists,govtech-govtech-33.9,Is there an entity to monitor & report Digital/GovTech spending for the whole government?,0=Unknown/n.a;1=No;2=Yes,
GovTech Maturity,GovTech Governance,Transparency,govtech-govtech-33.1,Publishing of the GovTech institution's annual progress report (results / spending)?,0=Unknown/n.a;1=No;2=Yes (internal;not published); 3=Yes (public;published),
GovTech Maturity,Data Governance,Data governance body exists,govtech-datagov-34,Is there a dedicated government entity in charge of data governance or data management?,0=Unknown/n.a;1=No;2= Planned / In progress;3=Yes (Established),
GovTech Maturity,Data Governance,Type of body,govtech-datagov-34.4,Type of Data Governance institution,0=Unkown/n.a.;1=Part of another institution;2=Autonomous institution,
GovTech Maturity,Data Governance,Arrangements,govtech-datagov-34.5,Data Governance implementation arrangements,0=Unkown/n.a.;1=Holistic DG approach;2=Multilevel DG approach,Holistic approach: Central DG body supporting all entities; Multilevel DG approach: Central or Federal agency for guidelines. DG impl by each federal/state entity separately
GovTech Maturity,Data Governance,Strategy,govtech-datagov-34.6,Is there a Data Governance strategy / policy?,0=Unknown/n.a;1=No;2= Planned / In progress;3=Yes (Approved),
GovTech Maturity,Data Governance,Transparency,govtech-datagov-34.7,Publishing of the Data Governance institution's progress report (results/spending)?,0=Unknown/n.a;1=No;2=Yes (internal;not published); 3=Yes (public;published),
GovTech Maturity,Digital Transformation Strategy,Strategy,govtech-digitransform-35,Is there a GovTech / Digital Transformation strategy? ,0=Unknown/n.a;1=No;2= Planned / In draft;3=Yes (old/to be updated);4=Yes (new/current),
GovTech Maturity,Digital Transformation Strategy,Whole of government approach,govtech-digitransform-36,Is there a whole-of-government approach to public sector digital transformation?,0=Unknown/n.a;1=No;2= Planned / In draft;3=Yes (Institutionalized),"To select I-36=2, I-2, I-3, I-4 should be 2 (EA, Interoperability, GSB in use)"
GovTech Maturity,Digital Transformation Strategy,Leadership,govtech-digitransform-36.2,Is there a Ministry / Dept leading the public sector digital transformation / cultural change / WoG approach?,0=Unknown/n.a;1=No;2=Yes,
