Chapter,Section,Variable Name,Variable Id,Definition,Format,Other Metadata
GovTech Maturity,Digital Transformation Strategy,Cross-government forum,govtech-digitransform-36.3,"Is there a cross government forum where strategic WoG topics (digital, data, technology, capacity) can be addressed by senior digital officials across government?",0=Unknown/n.a;1=No;2=Yes,
GovTech Maturity,Digital Transformation Strategy,Transparency,govtech-digitransform-36.4,"Publishing of the progress in WoG approach / digital transformation (results, spending)?",0=Unknown/n.a;1=No;2=Yes (internal;not published); 3=Yes (public;published),
GovTech Maturity,Right to Information,Legislation exists,govtech-rti-37,Are there RTI Laws to make data/info available to the public online or digitally?,0=Unknown/n.a;1=No;2=Draft / Consultations in progress;3=Yes (Effective),
GovTech Maturity,Right to Information,Monitoring,govtech-rti-37.3,Is there an entity monitoring implementation/compliance?,0=Unknown/n.a;1=No;2=Yes,
GovTech Maturity,Right to Information,RTI transparency,govtech-rti-37.4,"Publishing of the progress in implementing RTI laws (RTI requests received, granted, etc.)?",0=Unknown/n.a;1=No;2=Yes (internal;not published); 3=Yes (public;published),
GovTech Maturity,Data Protection,Legislation exists,govtech-dataprotect-38,Is there a Data Protection / Privacy law?,0=Unknown/n.a;1=No;2=Draft / Consultations in progress;3=Yes (Effective),
GovTech Maturity,Data Protection,Monitoring,govtech-dataprotect-38.4,Is there an entity monitoring implementation/compliance?,0=Unknown/n.a;1=No;2=Yes,
GovTech Maturity,Data Protection,Transparency,govtech-dataprotect-38.5,Publishing of the data protection/privacy complaints and feedback?,0=Unknown/n.a;1=No;2=Yes (internal;not published); 3=Yes (public;published),
GovTech Maturity,Data Protection,DPA exists,govtech-dataprotect-39,Is there a Data Protection Authority?,0=Unknown/n.a;1=No;2=Not established yet (visible in law);3=Yes,
GovTech Maturity,Data Protection,DPA transparency,govtech-dataprotect-39.4,Publishing of the Data Protection Authority performance/results?,0=Unknown/n.a;1=No;2=Yes (internal;not published); 3=Yes (public;published),
GovTech Maturity,Digital Skills,Strategy,govtech-skills-45,Is there a government strategy / program to improve digital skills in the public sector?,0=Unknown/n.a;1=No;2=Yes (Only strategy or program);3=Yes (Both strategy and program),
GovTech Maturity,Digital Skills,Focus areas,govtech-skills-45.4,Focus areas of the DS strategy,0=Unkown/n.a.;1=Basic Digital Skills;2=Basic DS + Data Literacy;3=Advanced DS + DL,
GovTech Maturity,Digital Skills,Programme,govtech-skills-45.5,Is there a DS program?,0=Unknown/n.a;1=No;2=Yes,
GovTech Maturity,Digital Skills,Programme,govtech-skills-45.5,If Yes > Type of primary DS program(s),0=Unkown/n.a.;1=Academic program;2=Public sector program;3=CSO/Private program,
GovTech Maturity,Digital Skills,Programme,govtech-skills-45.5,If Yes > DS program mandatory for new public employees?,0=Unkown/n.a.;1=Not mandatory;2=Mandatory,
GovTech Maturity,Digital Skills,Citizens and schools,govtech-skills-45.6,Are there digital skills programs offered by governments for citizens/schools?,0=Unknown/n.a;1=No;2=Yes (fee-based programs);3=Yes (freely available programs),
GovTech Maturity,Digital Skills,Transparency,govtech-skills-45.7,Publishing of the results/progress in DS programs?,0=Unknown/n.a;1=No;2=Yes (internal;not published); 3=Yes (public;published),
GovTech Maturity,Public Sector Innovation,Strategy,govtech-publicinnov-46,Is there a strategy and/or program to improve public sector innovation?,0=Unknown/n.a;1=No;2=Yes (Only strategy or program);3=Yes (Both strategy and program),
GovTech Maturity,Public Sector Innovation,Programme,govtech-publicinnov-46.4,Is there a PSI program?,0=Unknown/n.a;1=No;2=Yes,
GovTech Maturity,Public Sector Innovation,Programme,govtech-publicinnov-46.4,If Yes > Type of primary PSI program(s),0=Unkown/n.a.;1=Academic program;2=Public sector program;3=CSO/Private program,
GovTech Maturity,Public Sector Innovation,Programme,govtech-publicinnov-46.4,If Yes > PSI program mandatory for new public employees?,0=Unkown/n.a.;1=Not mandatory;2=Mandatory,
GovTech Maturity,Public Sector Innovation,Transparency,govtech-publicinnov-46.5,Publishing of the results/progress in PSI programs?,0=Unknown/n.a;1=No;2=Yes (internal;not published); 3=Yes (public;published),
GovTech Maturity,Public Sector Innovation,Leadership,govtech-publicinnov-47,Is there a government entity focused on public sector innovation?,0=Unknown/n.a;1=No;2=Planned / In progress;3=Yes (Established),
GovTech Maturity,Public Sector Innovation,Focus areas,govtech-publicinnov-47.4,Focus areas of PSI institution (Innovation Lab),0=Unkown/n.a.;1=Digital Skills;2=PS Innovation;3=Digital Skills + PS Innovation;4=Other,
GovTech Maturity,Public Sector Innovation,Public-private collaboration,govtech-publicinnov-47.5,Is there any collaboration on PSI with the private sector?,0=Unknown/n.a;1=No;2=Yes,
GovTech Maturity,Public Sector Innovation,Public-private collaboration,govtech-publicinnov-47.5,If Yes > Is there any financial support/incentive for private GovTech entities,0=Unknown/n.a;1=No;2=Yes,
GovTech Maturity,Public Sector Innovation,Transparency,govtech-publicinnov-47.6,Publishing the PSI institution annual performance/results?,0=Unknown/n.a;1=No;2=Yes (internal;not published); 3=Yes (public;published),
GovTech Maturity,Startup Support,Policy  ,govtech-startup-48,Is there a government policy to support GovTech startups and private sector investments?,0=Unknown/n.a;1=No;2=Yes,
GovTech Maturity,Startup Support,Financing,govtech-startup-48.4,Does the Government provide financing to startups/SMEs for innovation?,0=Unknown/n.a;1=No;2=Yes,
GovTech Maturity,Startup Support,Online services,govtech-startup-48.5,Capacity of Government to deliver online services via PPPs,0=Unknown/n.a;1=No PPP for online services 2=Yes;PPP arrangements exist for online service delivery,
GovTech Maturity,Startup Support,SME support,govtech-startup-48.6,"Is there a procurement policy aimed at prioritizing bids from startups/SMEs? (e.g., having a quota for SMEs)",0=Unknown/n.a;1=No;2=Yes,
GovTech Maturity,Startup Support,Transparency,govtech-startup-48.7,Publishing of the results/progress in supporting startups/SMEs for innovation?,0=Unknown/n.a;1=No;2=Yes (internal;not published); 3=Yes (public;published),
